"Timestamp","Username","Name (नाम)","Phone number with country code  (देश कोड के साथ फोन नंबर)","Which country do you live in? (आप कौन से देश में रहती हो)","Which city do you stay in? (आप किस शहर में रहते हैं?)","Are you a parent, student, teacher or someone else? (क्या आप माता-पिता, छात्र, शिक्षक या कोई और हैं?)","How old are your children?  आपके बच्छे कितने साल के हैं? [1st child]","How old are your children?  आपके बच्छे कितने साल के हैं? [2nd child]","How old are your children?  आपके बच्छे कितने साल के हैं? [3rd child]","How old are your children?  आपके बच्छे कितने साल के हैं? [4th child]","How old are your children?  आपके बच्छे कितने साल के हैं? [more than 5 children]","Which school are they studying in? वे किस स्कूल में पढ़ रहे हैं?","How are they currently attending class? वे वर्तमान में कक्षा में कैसे भाग ले रहे हैं?","What is your current occupation? आपका वर्तमान पेशा क्या है?","In the changed scenario, how would you like education to be? बदले हुए परिदृश्य में आप शिक्षा को कैसा बनाना चाहेंगे?","How important are offline interactions for the personal growth of your children? आपके बच्चों के व्यक्तिगत विकास के लिए ऑफ़लाइन इंटरैक्शन कितने महत्वपूर्ण हैं?","How important are offline interactions for the academic growth of your children? आपके बच्चों के शैक्षणिक विकास के लिए ऑफ़लाइन बातचीत कितनी महत्वपूर्ण है?","How frequent do you think these interactions could be done? आपको क्या लगता है कि ये बातचीत कितनी बार की जा सकती है?","Do you think its a good idea to involve other people like parents, professionally qualified play educators, volunteers etc. to facilitate this. If yes, who would it be? क्या आपको लगता है कि इसे सुविधाजनक बनाने के लिए माता-पिता, पेशेवर रूप से योग्य नाटक शिक्षकों, स्वयंसेवकों आदि जैसे अन्य लोगों को शामिल करना एक अच्छा विचार है। यदि हाँ, तो वह कौन होगा?","What do you think your kids could do during these interactions? आपको क्या लगता है कि आपके बच्चे इन बातचीत के दौरान क्या कर सकते हैं?","If we were to conduct these interactions what venue would be ideal for these interactions? यदि हम इन अंतःक्रियाओं का संचालन करते हैं तो इन अंतःक्रियाओं के लिए कौन सा स्थान आदर्श होगा?","How old are you? आपकी उम्र क्या है?","Which school are you studying in? आप किस स्कूल में पढ़ रहे हैं?","How are you currently attending class (आप वर्तमान में कक्षा में कैसे उपस्थित हो रहे हैं)","After Covid19, how would you like your classes to be?(Covid19 के बाद, आप अपनी कक्षाओं को कैसा बनाना चाहेंगे?)","How important are offline interactions for your own personal growth? आपके व्यक्तिगत विकास के लिए ऑफ़लाइन इंटरैक्शन कितने महत्वपूर्ण हैं?","How important are offline interactions for your own academic growth? आपके अपने शैक्षणिक विकास के लिए ऑफ़लाइन इंटरैक्शन कितने महत्वपूर्ण हैं?","How frequent do you think these interactions could be done?(आपको क्या लगता है कि ये बातचीत कितनी बार की जा सकती है?)","Who do you think could host these interactions?(आपको क्या लगता है कि इन इंटरैक्शन की मेजबानी कौन कर सकता है?)","What do you think you could do during these interactions?(आपको क्या लगता है कि आप इन बातचीत के दौरान क्या कर सकते हैं?)","If we were to participate in these interactions where would you like it to be?(यदि हम इन अंतःक्रियाओं में भाग लेते तो आप कहाँ होना चाहेंगे?)","In the changed scenario how would you like education to be?(बदले हुए परिदृश्य में आप शिक्षा को कैसा बनाना चाहेंगे?)","How important are offline interactions for the personal growth of the students? छात्रों के व्यक्तिगत विकास के लिए ऑफलाइन इंटरैक्शन कितने महत्वपूर्ण हैं?","How important are offline interactions for the academic growth of the students? छात्रों के शैक्षणिक विकास के लिए ऑफलाइन बातचीत कितनी महत्वपूर्ण है?","How frequent do you think these interactions could be done?(आपको क्या लगता है कि ये बातचीत कितनी बार की जा सकती है?)","Do you think its a good idea to involve other people like parents, professionally qualified play educators, volunteers etc. to facilitate this. If yes, who would it be? क्या आपको लगता है कि इसे सुविधाजनक बनाने के लिए माता-पिता, पेशेवर रूप से योग्य नाटक शिक्षकों, स्वयंसेवकों आदि जैसे अन्य लोगों को शामिल करना एक अच्छा विचार है। यदि हाँ, तो वह कौन होगा?","What do you think the students could do during these interactions?(आपको क्या लगता है कि इन अंतःक्रियाओं के दौरान विद्यार्थी क्या कर सकते हैं?)","If we were to conduct these interactions what venue would be ideal for these interactions? (यदि हम इन अंतःक्रियाओं का संचालन करते हैं तो इन अंतःक्रियाओं के लिए ","What is your current occupation? (आपका वर्तमान पेशा क्या है?)","In the changed scenario how would you like education to be? (बदले हुए परिदृश्य में आप शिक्षा को कैसा बनाना चाहेंगे?)","How important are offline interactions for the personal growth of the students? छात्रों के व्यक्तिगत विकास के लिए ऑफलाइन इंटरैक्शन कितने महत्वपूर्ण हैं?","How important are offline interactions for the academic growth of the students? छात्रों के शैक्षणिक विकास के लिए ऑफलाइन बातचीत कितनी महत्वपूर्ण है?","How frequent do you think these interactions could be done?(आपको क्या लगता है कि ये बातचीत कितनी बार की जा सकती है?)","Do you think its a good idea to involve other people like parents, professionally qualified play educators, volunteers etc. to facilitate this. If yes, who would it be? क्या आपको लगता है कि इसे सुविधाजनक बनाने के लिए माता-पिता, पेशेवर रूप से योग्य नाटक शिक्षकों, स्वयंसेवकों आदि जैसे अन्य लोगों को शामिल करना एक अच्छा विचार है। यदि हाँ, तो वह कौन होगा?","What do you think the students could do during these interactions?(आपको क्या लगता है कि इन अंतःक्रियाओं के दौरान विद्यार्थी क्या कर सकते हैं?)","If we were to conduct these interactions what venue would be ideal for these interactions? (यदि हम इन अंतःक्रियाओं का संचालन करते हैं तो इन अंतःक्रियाओं के लिए "
"2021/12/10 11:16:56 AM GMT+5:30","tylerjd68@gmail.com","Joshua David","9840911392","India","Bangalore ","Student (विद्यार्थी)","","","","","","","","","","","","","","","","11 - 14 years old","eggheads education private limited","Hybrid(Mix of both) (दोनों साथ में)","Fully offline (पूरी तरह से ऑफ़लाइन)","4","4","Twice a month (महीने में दो बार)","Teachers (शिक्षकों)","Sports (खेल)","all the things are great i would like to go in all this places once everytime","","","","","","","","","","","","","","",""
"2021/12/10 11:17:08 AM GMT+5:30","anay.balar@gmail.com","anay balar","","India","bangalore","Student (विद्यार्थी)","","","","","","","","","","","","","","","","11 - 14 years old","eggheads","Online(Zoom meets etc) (ऑनलाइन)","Fully online (पूरी तरह से ऑनलाइन)","3","3","Once a month (महीने में एक बार)","Professionally qualified play educators(पेशेवर रूप से योग्य नाटक शिक्षक)","Adventure (साहसिक कार्य);Sports (खेल)","Theatre (Moves  or Acting) (रंगमंच (चाल या अभिनय));Museums (संग्रहालय)","","","","","","","","","","","","","","",""
"2021/12/10 11:18:25 AM GMT+5:30","tejas75O25@gmail.com","Tejas","+9119980168701","India","Bangalore","Student (विद्यार्थी)","","","","","","","","","","","","","","","","11 - 14 years old","Eggheads Education Private Limited","Online(Zoom meets etc) (ऑनलाइन)","Mix of both  (दोनों साथ में)","5","5","Twice a month (महीने में दो बार)","Parents (माता - पिता);Teachers (शिक्षकों);Volunteers (स्वयंसेवकों);Professionally qualified play educators(पेशेवर रूप से योग्य नाटक शिक्षक)","Dance & music recitals (नृत्य और संगीत की प्रस्तुति);Adventure (साहसिक कार्य);Sports (खेल);Board Games (बोर्ड खेल);Arts & Crafts (कला और शिल्प);Experiments","Resort (आश्रय);Playgrounds (खेल के मैदानों;Theatre (Moves  or Acting) (रंगमंच (चाल या अभिनय));Zoos (चिड़ियाघरों);Planetarium (नक्षत्र-भवन);Museums (संग्रहालय)","","","","","","","","","","","","","","",""
"2021/12/10 11:20:29 AM GMT+5:30","alihasan.danish@gmail.com","wwww","77777777","United Arab Emirates","hhhhhhhhh","Student (विद्यार्थी)","","","","","","","","","","","","","","","","11 - 14 years old","eeeeee","Online(Zoom meets etc) (ऑनलाइन)","Fully online (पूरी तरह से ऑनलाइन)","3","2","Every week (हर हफ्तI)","Parents (माता - पिता)","Sports (खेल)","Resort (आश्रय)","","","","","","","","","","","","","","",""
"2021/12/10 11:28:41 AM GMT+5:30","anay.balar@gmail.com","anay balar","","India","AHMEDABAD","Other (कोई और)","","","","","","","","","","","","","","","","","","","","","","","","","","","","","","","","","idk ","fully online (पूरी तरह से ऑनलाइन)","3","3","Once a month (महीने में एक बार)","Teachers (शिक्षकों)","Board Games (बोर्ड खेल)","Theatre (Moves  or Acting) (रंगमंच (चाल या अभिनय))"
"2021/12/10 11:29:52 AM GMT+5:30","alihasan.danish@gmail.com","Ali","0505050505","United Arab Emirates","Sharjah","Parent (माता-पिता)","11 - 14 years","11 - 14 years","6 - 10 years","0 - 5 years","","EggHeads","Online(Zoom meets etc) (ऑनलाइन)","idk","Mix of both  (दोनों साथ में)","5","5","Once a month (महीने में एक बार)","Parents (माता - पिता);Teachers (शिक्षकों);Volunteers (स्वयंसेवकों)","Sports (खेल);Board Games (बोर्ड खेल);Arts & Crafts (कला और शिल्प)","Adventure Parks (साहसिक पार्क);Playgrounds (खेल के मैदानों;Theatre (Moves  or Acting) (रंगमंच (चाल या अभिनय));Zoos (चिड़ियाघरों)","","","","","","","","","","","","","","","","","","","","","","","","",""
"2021/12/10 11:31:16 AM GMT+5:30","jd094376@gmail.com","Joshua f david","9969508988","India","Bangalore","Teacher (शिक्षक)","","","","","","","","","","","","","","","","","","","","","","","","","","fully offline (पूरी तरह से ऑफ़लाइन)","4","3","Every week (हर हफ्तI)","Teachers (शिक्षकों)","the child must do all the things which is mentioned at different times","all the places are exiting actually","","","","","","","",""